{
  "version_esquema": "CatalystDetection_v1",
  "caso_id": "CASE_20260311_ACLS",
  "fecha_corte": "2026-03-11",
  "claims_list": [],
  "catalyst_candidates": [
    {
      "catalyst_id": "CAT_OP_001",
      "descripcion": "Monetización de inventario acumulado y normalización del capital de trabajo para restaurar la conversión robusta de CFO.",
      "tipo": "OPERATIVO",
      "estado_actual": "Inventario en máximos de $329M frente a ingresos en declive de $839M en FY25, lo que contribuyó a un CFO negativo en el Q4-2025.",
      "evidencia_actual": [
        {
          "source_id": "SRC_001_10-K_FY2025",
          "ubicacion": "Balance Sheet - us-gaap:InventoryNet",
          "cita": "InventoryNet reportado en 329,010,000 USD."
        },
        {
          "source_id": "ImpliedExpectations_v1",
          "ubicacion": "log.limitaciones",
          "cita": "Q4-2025 mostro CFO negativo, lo que introduce volatilidad en la lectura del FCF base."
        }
      ],
      "evidencia_confirmada_futura": "Reducción absoluta del saldo contable de inventarios y reporte de CFO trimestral consistentemente positivo >$30M en los próximos 2 a 3 trimestres.",
      "drivers_afectados": [
        {
          "driver": "FCF",
          "direccion": "↑",
          "magnitud_estimada": "Alta"
        }
      ],
      "indicadores_lideres": [
        "Reducción observable en los días de inventario pendiente (DIO).",
        "Retorno a CFO positivo durante el Q1 y Q2 de 2026.",
        "Comunicación gerencial sobre el despacho de equipos retenidos o retrasados."
      ],
      "riesgos_ejecucion": [
        "Obsolescencia tecnológica del inventario actual frente a nuevas demandas de fabs.",
        "Cancelaciones de pedidos existentes en la cartera.",
        "Incapacidad de vender equipos sin recurrir a descuentos agresivos que dañen márgenes."
      ],
      "contracatalizadores": [
        "Aumento continuo del saldo de inventario durante el primer semestre de 2026.",
        "Anuncio de cargos contables por deterioro (write-downs) de inventario."
      ]
    },
    {
      "catalyst_id": "CAT_OP_002",
      "descripcion": "Recuperación del ciclo de inversión en equipos semiconductores reflejado en un Book-to-Bill ratio > 1.0.",
      "tipo": "OPERATIVO",
      "estado_actual": "Ingresos cayeron desde un pico de $1.13B en FY2023 a $839M en FY2025, marcando una fuerte desaceleración cíclica.",
      "evidencia_actual": [
        {
          "source_id": "SRC_001_10-K_FY2025",
          "ubicacion": "Income Statement - us-gaap:Revenues",
          "cita": "Revenues cayeron a 839,048,000 USD en FY2025."
        }
      ],
      "evidencia_confirmada_futura": "Confirmación de que las nuevas órdenes superan la facturación (Book-to-Bill > 1) por 2 trimestres consecutivos.",
      "drivers_afectados": [
        {
          "driver": "Ingresos",
          "direccion": "↑",
          "magnitud_estimada": "Alta"
        },
        {
          "driver": "Múltiplo",
          "direccion": "↑",
          "magnitud_estimada": "Media"
        }
      ],
      "indicadores_lideres": [
        "Anuncios públicos de planes de expansión de capex por parte de grandes fundiciones de chips.",
        "Aumento sostenido en el backlog (cartera de pedidos) en los próximos trimestres.",
        "Fortaleza en el segmento específico de equipos de implantación iónica."
      ],
      "riesgos_ejecucion": [
        "Prolongación macroeconómica del valle del ciclo de semiconductores.",
        "Restricciones regulatorias gubernamentales (ej. a exportaciones hacia Asia).",
        "Pérdida de market share frente a competidores en nodos avanzados."
      ],
      "contracatalizadores": [
        "Book-to-Bill manteniéndose por debajo de 1.0.",
        "Ajustes a la baja en el guidance corporativo de ingresos para 2026."
      ]
    },
    {
      "catalyst_id": "CAT_OP_003",
      "descripcion": "Expansión y estabilización de márgenes operativos mediante optimización de costos y apalancamiento operativo.",
      "tipo": "OPERATIVO",
      "estado_actual": "El EBIT cayó severamente de $265M en FY2023 a $119M en FY2025 por la menor absorción de costos fijos.",
      "evidencia_actual": [
        {
          "source_id": "SRC_001_10-K_FY2025",
          "ubicacion": "Income Statement - us-gaap:OperatingIncomeLoss",
          "cita": "EBIT reportado en 119,315,000 USD en FY2025 frente a 265,795,000 USD en FY2023."
        }
      ],
      "evidencia_confirmada_futura": "Recuperación secuencial del margen EBIT trimestral tendiendo hacia su promedio histórico >18%.",
      "drivers_afectados": [
        {
          "driver": "Margen",
          "direccion": "↑",
          "magnitud_estimada": "Alta"
        }
      ],
      "indicadores_lideres": [
        "Estabilización del margen bruto por encima del 44%.",
        "Crecimiento de los ingresos superior al crecimiento de los gastos operativos (SG&A).",
        "Ejecución de programas corporativos de eficiencia."
      ],
      "riesgos_ejecucion": [
        "Presión inflacionaria sobre componentes críticos de fabricación.",
        "Necesidad de sostener gasto estructural elevado en I+D para mantener competitividad.",
        "Erosión de precios (pricing power) para poder liquidar el inventario acumulado."
      ],
      "contracatalizadores": [
        "Caída continuada del margen bruto en los próximos reportes.",
        "Aumento absoluto de gastos SG&A pese al estancamiento de ingresos."
      ]
    },
    {
      "catalyst_id": "CAT_CORP_001",
      "descripcion": "Resolución de la opacidad de reporte en el balance mediante la clarificación de la deuda total y estructura de capital.",
      "tipo": "CORPORATIVO",
      "estado_actual": "Ausencia de reporte claro de deuda_total_usd bloqueando la inferencia de expectativas (calidad PARTIAL).",
      "evidencia_actual": [
        {
          "source_id": "ImpliedExpectations_v1",
          "ubicacion": "resumen_expectativas_implicitas.faltantes_criticos",
          "cita": "Sin deuda total no se puede derivar EV ni evaluar riesgo financiero/balance."
        }
      ],
      "evidencia_confirmada_futura": "Publicación de un balance o 10-Q/10-K con desglose granular de las obligaciones financieras (corto y largo plazo).",
      "drivers_afectados": [
        {
          "driver": "Múltiplo",
          "direccion": "↑",
          "magnitud_estimada": "Baja"
        }
      ],
      "indicadores_lideres": [
        "Actualizaciones de los materiales para inversores con el desglose de capitalización.",
        "Subsanación del missing data en los agregadores de mercado tras los reportes.",
        "Eventos de refinanciación explícitos."
      ],
      "riesgos_ejecucion": [
        "Descubrimiento de pasivos no registrados previamente o covenants restrictivos severos.",
        "Resistencia gerencial a proporcionar visibilidad adicional de la estructura."
      ],
      "contracatalizadores": [
        "Próximos filings SEC continúan omitiendo de manera atípica las partidas estándar de deuda.",
        "Aparición sorpresiva de problemas de liquidez o advertencias de covenants."
      ]
    },
    {
      "catalyst_id": "CAT_FIN_001",
      "descripcion": "Asignación disciplinada de capital orientada al accionista (recompras de acciones) apalancando la caja libre existente.",
      "tipo": "FINANCIERO",
      "estado_actual": "El balance cuenta con $145.4M en efectivo a pesar del año difícil en flujo de caja y rentabilidad.",
      "evidencia_actual": [
        {
          "source_id": "SRC_001_10-K_FY2025",
          "ubicacion": "Balance Sheet - us-gaap:CashAndCashEquivalentsAtCarryingValue",
          "cita": "CashAndCashEquivalents reportado en 145,451,000 USD al cierre de FY25."
        }
      ],
      "evidencia_confirmada_futura": "Aprobación de la junta de un nuevo programa de recompra y reducción comprobada del número de acciones en circulación en 6-12 meses.",
      "drivers_afectados": [
        {
          "driver": "FCF",
          "direccion": "↑",
          "magnitud_estimada": "Media"
        }
      ],
      "indicadores_lideres": [
        "Aceleración progresiva en las tasas trimestrales de retiro de acciones.",
        "Confirmación de la no intención de ejecutar M&A disruptivo a corto plazo.",
        "Generación suficiente de caja libre (FCF) mensual que permita recompras orgánicas."
      ],
      "riesgos_ejecucion": [
        "Destrucción de valor al usar la caja para adquisiciones cuestionables a múltiplos altos.",
        "Caja requerida como red de seguridad debido al deterioro imprevisto del negocio base."
      ],
      "contracatalizadores": [
        "Dilución neta observada por alta compensación basada en acciones (SBC).",
        "Anuncio de fusiones/adquisiciones fuera del core de negocio o de alto riesgo."
      ]
    }
  ]
}