{
  "$schema": "http://json-schema.org/draft-07/schema#",
  "version_esquema": "CatalystDetection_v1",
  "caso_id": "CASE_20260224_SONO",
  "fecha_corte": "2026-02-24",
  "ticker": "SONO",
  "claims_list": [
    {
      "claim_id": "CLM_01",
      "enunciado": "La reducción del 26% en R&D en Q1-2026 señala un cambio estructural hacia la rentabilidad operativa sobre el crecimiento a toda costa.",
      "ref_evidence": "TruthPack_v1 > Q1-2026 > rd_usd"
    },
    {
      "claim_id": "CLM_02",
      "enunciado": "La expansión del margen bruto al 46.4% en Q1-2026 sugiere poder de fijación de precios o eficiencias de costes no vistas en FY2025.",
      "ref_evidence": "TruthPack_v1 > Q1-2026 > gross_profit_usd / ingresos_usd"
    },
    {
      "claim_id": "CLM_03",
      "enunciado": "La generación de FCF en FY2025 dependió de la liberación de inventario; el futuro FCF depende de márgenes sostenibles.",
      "ref_evidence": "TruthPack_v1 > Balance Sheet > Inventarios"
    },
    {
      "claim_id": "CLM_04",
      "enunciado": "La valoración actual (EV/FCF ~15x) implica un crecimiento modesto, pero los múltiplos de hardware (10-12x) exigen mayor disciplina de capital.",
      "ref_evidence": "ImpliedExpectations_v1 > Multiples Implicitos"
    }
  ],
  "catalyst_candidates": [
    {
      "catalyst_id": "CAT_SONO_01",
      "descripcion": "Consolidación estructural de gastos operativos (R&D) mejorando el apalancamiento operativo anualizado.",
      "tipo": "OPERATIVO",
      "estado_actual": "En progreso (Cortes iniciales visibles en Q1-2026)",
      "evidencia_actual": [
        {
          "source_id": "SRC_SEC_007_10-Q_Q4-2025",
          "ubicacion": "Income Statement Q1-2026",
          "cita": "R&D expenses decreased to $59.7M in Q1-2026 from $80.8M in Q1-2025 (-26% YoY)."
        }
      ],
      "evidencia_confirmada_futura": {
        "test_medible": "Gastos R&D trimestrales mantenidos por debajo de $65M en trimestres no estacionales.",
        "umbral": "< $260M anualizados",
        "ventana_tiempo": "6-12 meses"
      },
      "drivers_afectados": [
        {
          "driver": "EBIT Margin",
          "direccion": "UP",
          "magnitud": "Alto (Impacto directo en bottom-line)"
        },
        {
          "driver": "FCF",
          "direccion": "UP",
          "magnitud": "Medio"
        }
      ],
      "indicadores_lideres": [
        "Mantenimiento de run-rate de R&D en ~$60M en reporte Q2-2026",
        "EBIT positivo en trimestres tradicionalmente débiles (Q2/Q3)",
        "Ausencia de cargos de reestructuración adicionales"
      ],
      "riesgos_ejecucion": [
        "Impacto negativo en pipeline de innovación a largo plazo",
        "Pérdida de talento clave en ingeniería",
        "Incapacidad de lanzar productos a tiempo por falta de recursos"
      ],
      "contracatalizadores": [
        "Re-aceleración del gasto en R&D por competencia intensificada",
        "Retrasos en lanzamientos de productos (ej. sucesor de Arc)"
      ]
    },
    {
      "catalyst_id": "CAT_SONO_02",
      "descripcion": "Expansión sostenida del Margen Bruto mediante mix de productos y eficiencia de componentes.",
      "tipo": "FINANCIERO",
      "estado_actual": "Señal temprana positiva (Q1-2026 GM 46.4%)",
      "evidencia_actual": [
        {
          "source_id": "SRC_SEC_007_10-Q_Q4-2025",
          "ubicacion": "Financial Results Q1-2026",
          "cita": "Gross Margin expansion to 46.4% in Q1-2026 vs FY2025 average of 43.7%."
        }
      ],
      "evidencia_confirmada_futura": {
        "test_medible": "Margen Bruto promedio móvil de 4 trimestres superando el 45%.",
        "umbral": "> 45%",
        "ventana_tiempo": "12 meses"
      },
      "drivers_afectados": [
        {
          "driver": "Gross Margin",
          "direccion": "UP",
          "magnitud": "Alto"
        },
        {
          "driver": "Valuation Multiple",
          "direccion": "UP",
          "magnitud": "Medio (Justifica múltiplo premium)"
        }
      ],
      "indicadores_lideres": [
        "Estabilidad de precios de venta promedio (ASP)",
        "Reducción de costes de flete/componentes en COGS",
        "Mix de ventas favorable hacia hardware nuevo (Ace/Arc Ultra)"
      ],
      "riesgos_ejecucion": [
        "Aumento de actividad promocional para mover inventario viejo",
        "Inflación de costes de componentes",
        "Mix shift hacia productos de menor margen"
      ],
      "contracatalizadores": [
        "Retorno a márgenes brutos <44%",
        "Guerra de precios en categoría de audio premium"
      ]
    },
    {
      "catalyst_id": "CAT_SONO_03",
      "descripcion": "Estabilización de ingresos y retorno al crecimiento mediante nuevas categorías (Headphones).",
      "tipo": "OPERATIVO",
      "estado_actual": "Estabilización incipiente (Caída reducida a -1% en Q1-2026)",
      "evidencia_actual": [
        {
          "source_id": "SRC_SEC_007_10-Q_Q4-2025",
          "ubicacion": "Income Statement",
          "cita": "Revenue Q1-2026 $546M vs Q1-2025 $550M (-0.9% YoY decline vs -5% FY25 trend)."
        }
      ],
      "evidencia_confirmada_futura": {
        "test_medible": "Crecimiento de ingresos YoY positivo en 2 trimestres consecutivos.",
        "umbral": "> 0% YoY",
        "ventana_tiempo": "6-9 meses"
      },
      "drivers_afectados": [
        {
          "driver": "Revenue Growth",
          "direccion": "UP",
          "magnitud": "Alto"
        },
        {
          "driver": "FCF",
          "direccion": "UP",
          "magnitud": "Alto (Apalancamiento operativo)"
        }
      ],
      "indicadores_lideres": [
        "Crecimiento secuencial en Q2/Q3 mejor que estacionalidad histórica",
        "Comentarios de canal sobre ventas de Sonos Ace",
        "Activaciones de nuevos hogares (metric reportada anualmente)"
      ],
      "riesgos_ejecucion": [
        "Fracaso comercial de la línea de auriculares",
        "Saturación del mercado de audio doméstico",
        "Debilidad macroeconómica del consumidor"
      ],
      "contracatalizadores": [
        "Aceleración de la caída de ingresos a > -5% YoY",
        "Pérdida de cuota de mercado ante competidores (Bose, Sony)"
      ]
    },
    {
      "catalyst_id": "CAT_SONO_04",
      "descripcion": "Optimización permanente del Capital de Trabajo (Inventarios) elevando conversión de caja.",
      "tipo": "FINANCIERO",
      "estado_actual": "Ejecutado (Reducción de inventario lograda en FY25)",
      "evidencia_actual": [
        {
          "source_id": "SRC_SEC_001_10-K_FY2025",
          "ubicacion": "Balance Sheet",
          "cita": "Inventories reduced to $171M at FY25 end from $232M at FY24 end (-26%)."
        }
      ],
      "evidencia_confirmada_futura": {
        "test_medible": "Días de inventario (DIO) mantenidos bajo control sin repuntes estacionales excesivos.",
        "umbral": "< $180M saldo absoluto",
        "ventana_tiempo": "Permanente"
      },
      "drivers_afectados": [
        {
          "driver": "FCF",
          "direccion": "UP",
          "magnitud": "Medio (Evita cash drag)"
        },
        {
          "driver": "ROIC",
          "direccion": "UP",
          "magnitud": "Bajo"
        }
      ],
      "indicadores_lideres": [
        "Saldo de inventarios en balance trimestral",
        "Ratio Inventario/Ventas futuras",
        "Ausencia de provisiones por obsolescencia"
      ],
      "riesgos_ejecucion": [
        "Escasez de stock en temporada alta por gestión demasiado ajustada",
        "Acumulación de inventario de productos fallidos (Ace)"
      ],
      "contracatalizadores": [
        "Re-acumulación de inventarios >$220M",
        "Necesidad de liquidaciones agresivas para mover stock"
      ]
    },
    {
      "catalyst_id": "CAT_SONO_05",
      "descripcion": "Aceleración del retorno de capital (Buybacks) aprovechando valoración deprimida y caja neta.",
      "tipo": "CORPORATIVO",
      "estado_actual": "Activo (Recompras en curso)",
      "evidencia_actual": [
        {
          "source_id": "SRC_SEC_001_10-K_FY2025",
          "ubicacion": "Cash Flow Statement",
          "cita": "Repurchase of common stock: $102M in FY2025; Cash balance $174M."
        }
      ],
      "evidencia_confirmada_futura": {
        "test_medible": "Reducción del conteo de acciones diluidas >3% anual.",
        "umbral": "< 120M acciones",
        "ventana_tiempo": "12-18 meses"
      },
      "drivers_afectados": [
        {
          "driver": "EPS",
          "direccion": "UP",
          "magnitud": "Medio"
        },
        {
          "driver": "FCF per Share",
          "direccion": "UP",
          "magnitud": "Medio"
        }
      ],
      "indicadores_lideres": [
        "Ritmo de recompras trimestrales en CFF",
        "Autorizaciones de nuevos programas de recompra",
        "Mantenimiento de posición de Caja Neta positiva"
      ],
      "riesgos_ejecucion": [
        "Uso de caja para adquisiciones destructivas de valor",
        "Suspensión de recompras para preservar liquidez ante caída de ventas"
      ],
      "contracatalizadores": [
        "Dilución por compensación basada en acciones superando recompras",
        "Deterioro del balance sheet (consumo de caja)"
      ]
    }
  ],
  "input_refs": {
    "TruthPack_v1": "Utilizado para métricas históricas, estado financiero actual y validación de R&D/Márgenes.",
    "ImpliedExpectations_v1": "Utilizado para determinar la brecha de valoración y expectativas de crecimiento de FCF."
  }
}