{
  "version_esquema": "CatalystDetection_v1",
  "caso_id": "CASE_20260221_ACVA",
  "fecha_corte": "2026-02-21",
  "ticker": "ACVA",
  "claims_list": [],
  "catalyst_candidates": [
    {
      "catalyst_id": "CAT_001",
      "descripcion": "Inflexión hacia rentabilidad operativa GAAP impulsada por apalancamiento operativo en SG&A sobre crecimiento de ingresos.",
      "tipo": "FINANCIERO",
      "estado_actual": "ACTIVO",
      "evidencia_actual": [
        {
          "source_id": "SRC_006",
          "ubicacion": "Income Statement H1-2025",
          "cita": "EBIT loss narrowed to $21.6M in H1-2025 from $41.2M in H1-2024 while Revenue grew 23%."
        }
      ],
      "evidencia_confirmada_futura": {
        "test_medible": "EBIT trimestral positivo (GAAP)",
        "umbral": "> $0",
        "ventana_tiempo": "12-18 meses"
      },
      "drivers_afectados": [
        {
          "driver": "Margen Operativo",
          "direccion": "UP",
          "magnitud": "ALTA"
        },
        {
          "driver": "EPS",
          "direccion": "UP",
          "magnitud": "ALTA"
        }
      ],
      "indicadores_lideres": [
        "Reducción secuencial de pérdida operativa",
        "Crecimiento de ingresos > Crecimiento de OpEx"
      ],
      "riesgos_ejecucion": [
        "Desaceleración macroeconómica afectando volúmenes de autos usados",
        "Inflación salarial en equipos de ventas/tecnología"
      ],
      "contracatalizadores": [
        "Reversión de margen EBIT negativo a niveles de 2023",
        "Aumento súbito en gastos de marketing sin retorno inmediato"
      ]
    },
    {
      "catalyst_id": "CAT_002",
      "descripcion": "Aceleración estructural de conversión de flujo de caja libre (FCF) superando el crecimiento de ingresos.",
      "tipo": "FINANCIERO",
      "estado_actual": "ACTIVO",
      "evidencia_actual": [
        {
          "source_id": "SRC_006",
          "ubicacion": "Cash Flow Statement H1-2025",
          "cita": "CFO increased to $80.3M in H1-2025 from $47.5M in H1-2024 with low CapEx ($4.2M)."
        }
      ],
      "evidencia_confirmada_futura": {
        "test_medible": "FCF TTM sostenido",
        "umbral": "> $120M",
        "ventana_tiempo": "12-24 meses"
      },
      "drivers_afectados": [
        {
          "driver": "FCF",
          "direccion": "UP",
          "magnitud": "ALTA"
        },
        {
          "driver": "Deuda Neta",
          "direccion": "DOWN",
          "magnitud": "MEDIA"
        }
      ],
      "indicadores_lideres": [
        "Mantenimiento de días de cuentas por cobrar bajo control",
        "Ratio CFO/EBITDA ajustado estable o creciente"
      ],
      "riesgos_ejecucion": [
        "Necesidad de mayor CapEx para expansión física o tecnológica",
        "Deterioro en capital de trabajo por mix de clientes"
      ],
      "contracatalizadores": [
        "Consumo de caja operativo en trimestres estacionalmente débiles",
        "Aumento significativo de CapEx > 3% de ventas"
      ]
    },
    {
      "catalyst_id": "CAT_003",
      "descripcion": "Ganancia de cuota de mercado en subastas mayoristas digitales desplazando modelos físicos tradicionales.",
      "tipo": "CORPORATIVO",
      "estado_actual": "ACTIVO",
      "evidencia_actual": [
        {
          "source_id": "SRC_006",
          "ubicacion": "Financial Highlights H1-2025",
          "cita": "Revenue growth of ~23% YoY in H1-2025 ($376M vs $306M) sugiere ganancia de cuota continua."
        }
      ],
      "evidencia_confirmada_futura": {
        "test_medible": "Crecimiento de Ingresos YoY",
        "umbral": "> 15%",
        "ventana_tiempo": "6-12 meses"
      },
      "drivers_afectados": [
        {
          "driver": "Ingresos",
          "direccion": "UP",
          "magnitud": "ALTA"
        },
        {
          "driver": "Multiplo EV/Sales",
          "direccion": "UP",
          "magnitud": "MEDIA"
        }
      ],
      "indicadores_lideres": [
        "Volumen de unidades vendidas",
        "Adopción de nuevos vendedores/concesionarios"
      ],
      "riesgos_ejecucion": [
        "Respuesta agresiva de competidores incumbentes (Manheim, Adesa)",
        "Saturación de canales digitales"
      ],
      "contracatalizadores": [
        "Desaceleración de crecimiento de ingresos < 10%",
        "Pérdida de clientes clave o grupos de concesionarios"
      ]
    },
    {
      "catalyst_id": "CAT_004",
      "descripcion": "Mejora del Margen Bruto mediante eficiencia tecnológica en servicios de inspección y escala.",
      "tipo": "OPERATIVO",
      "estado_actual": "EMERGENTE",
      "evidencia_actual": [
        {
          "source_id": "SRC_006",
          "ubicacion": "Income Statement H1-2025",
          "cita": "Gross Margin expansion implied: 53.6% in H1-2025 vs 51.9% in H1-2024 (calc from Rev/COGS)."
        }
      ],
      "evidencia_confirmada_futura": {
        "test_medible": "Margen Bruto (Rev-COGS)/Rev",
        "umbral": "> 55%",
        "ventana_tiempo": "12-24 meses"
      },
      "drivers_afectados": [
        {
          "driver": "Margen Bruto",
          "direccion": "UP",
          "magnitud": "MEDIA"
        },
        {
          "driver": "EBIT",
          "direccion": "UP",
          "magnitud": "MEDIA"
        }
      ],
      "indicadores_lideres": [
        "Reducción de costo unitario por inspección",
        "Automatización de reportes de condición"
      ],
      "riesgos_ejecucion": [
        "Fallas tecnológicas en detección de daños",
        "Aumento de costos laborales de inspectores de campo"
      ],
      "contracatalizadores": [
        "Compresión de margen bruto por costos de arbitraje/garantías",
        "Aumento de tasa de defectos en inspecciones"
      ]
    },
    {
      "catalyst_id": "CAT_005",
      "descripcion": "Penetración de servicios de valor agregado (ACVA Capital/Transport) aumentando el 'take rate' efectivo.",
      "tipo": "OPERATIVO",
      "estado_actual": "ACTIVO",
      "evidencia_actual": [
        {
          "source_id": "SRC_001",
          "ubicacion": "Balance Sheet FY2024",
          "cita": "Presencia de Finance Receivables en balance indica actividad crediticia activa y creciente."
        }
      ],
      "evidencia_confirmada_futura": {
        "test_medible": "ARPU (Ingreso por Unidad)",
        "umbral": "Creciente YoY",
        "ventana_tiempo": "12-30 meses"
      },
      "drivers_afectados": [
        {
          "driver": "Ingresos",
          "direccion": "UP",
          "magnitud": "MEDIA"
        },
        {
          "driver": "Retorno sobre Capital",
          "direccion": "UP",
          "magnitud": "MEDIA"
        }
      ],
      "indicadores_lideres": [
        "Attach rate de transporte",
        "Volumen financiado por ACVA Capital"
      ],
      "riesgos_ejecucion": [
        "Riesgo de crédito en cartera de ACVA Capital",
        "Volatilidad en costos de transporte logístico"
      ],
      "contracatalizadores": [
        "Aumento de provisiones por pérdidas crediticias",
        "Caída en márgenes de segmento de servicios"
      ]
    }
  ],
  "input_refs": {
    "truth_pack_version": "TruthPack_v1",
    "implied_expectations_version": "ImpliedExpectations_v1"
  }
}